{
  "app_url": "https://prometheus-e83j.onrender.com",
  "extraction_date": "2026-04-22",
  "component_count": 18,
  "components": [
    {
      "name": "Header/Navbar",
      "slug": "header-navbar",
      "description": "Fixed top navigation bar present on every page. Contains the Prometheus logo, primary route links, and right-side utility ActionIcons. Background is a dark slate that does not change between light and dark themes.",
      "subtitle": "Global app shell navigation",
      "complexity": "complex",
      "category": "navigation",
      "pages": ["/query", "/alerts", "/rules", "/targets", "/service-discovery", "/status", "/tsdb-status", "/flags", "/config", "/alertmanager-discovery"],
      "props": [
        { "name": "activeRoute", "type": "string", "default": null, "required": false, "description": "Current route path — highlights the matching nav link." }
      ],
      "variants": [
        {
          "name": "default",
          "description": "Full navbar with logo, route links (Alerts, Graph, Status, Help), and utility icons (theme toggle, settings, docs).",
          "mock_css_class": "mock-app-header",
          "mock_html": "<div class=\"mock-app-header\"><span class=\"mock-app-header-logo\">🔥 Prometheus</span><nav class=\"mock-app-header-nav\"><a class=\"mock-nav-link mock-nav-active\" href=\"#\">Graph</a><a class=\"mock-nav-link\" href=\"#\">Alerts</a><a class=\"mock-nav-link\" href=\"#\">Status</a><a class=\"mock-nav-link\" href=\"#\">Help</a></nav><div class=\"mock-app-header-actions\"><button class=\"mock-action-icon\" title=\"Toggle theme\">☀</button><button class=\"mock-action-icon\" title=\"Settings\">⚙</button><button class=\"mock-action-icon\" title=\"Docs\">📖</button></div></div>",
          "tokens_used": ["nav-slate", "inverted"]
        }
      ],
      "layout": {
        "specs": [
          { "property": "height", "value": "56px", "token": "navbar-height" },
          { "property": "background", "value": "rgb(65,73,81)", "token": "nav-slate" },
          { "property": "position", "value": "fixed top-0" },
          { "property": "padding-inline", "value": "16px", "token": "md" },
          { "property": "z-index", "value": "100 (above page content)" }
        ]
      },
      "dos_and_donts": [
        { "type": "do", "text": "Keep the navbar background rgb(65,73,81) identical in light and dark themes — it is a product-brand anchor." },
        { "type": "do", "text": "Use Tabler Icons for all ActionIcons to stay consistent with the rest of the icon set." },
        { "type": "dont", "text": "Don't change the navbar background based on color scheme — it breaks the brand identity." },
        { "type": "dont", "text": "Don't add more than 4 primary route links without a dropdown or secondary nav." }
      ],
      "accessibility": {
        "aria_labels": "Theme toggle ActionIcon uses aria-label that flips between 'Switch to light theme' / 'Switch to dark theme'.",
        "keyboard": "Tab through nav links and ActionIcons. Active route link should have aria-current='page'.",
        "contrast": "White text on rgb(65,73,81) slate passes WCAG AA (contrast ~5.1:1).",
        "screen_reader": null
      },
      "code_example": "<AppShell header={{ height: 56 }}>\n  <AppShell.Header style={{ background: 'rgb(65,73,81)' }}>\n    <Group h=\"100%\" px=\"md\" justify=\"space-between\">\n      <Text c=\"white\" fw={700}>Prometheus</Text>\n      <Group gap=\"xs\">\n        <NavLink label=\"Graph\" href=\"/query\" />\n        <NavLink label=\"Alerts\" href=\"/alerts\" />\n      </Group>\n      <Group gap=\"xs\">\n        <ActionIcon aria-label=\"Switch to dark theme\" variant=\"transparent\" color=\"white\">\n          <IconSun size={18} />\n        </ActionIcon>\n      </Group>\n    </Group>\n  </AppShell.Header>\n</AppShell>",
      "related_inconsistencies": [],
      "origin": "derived"
    },
    {
      "name": "Mantine Card",
      "slug": "mantine-card",
      "description": "Primary content container used on 7 of 10 pages. Wraps all major content sections with a consistent white/dark background, 1px border, 4px corner radius, and a subtle box shadow.",
      "subtitle": "Content section container",
      "complexity": "simple",
      "category": "layout",
      "pages": ["/targets", "/service-discovery", "/status", "/tsdb-status", "/flags", "/config", "/alertmanager-discovery"],
      "props": [
        { "name": "children", "type": "ReactNode", "default": null, "required": true, "description": "Card content." },
        { "name": "padding", "type": "MantineSize", "default": "md", "required": false, "description": "Inner padding. Default 'md' = 16px." }
      ],
      "variants": [
        {
          "name": "default",
          "description": "Standard content card with border and shadow.",
          "mock_css_class": "mock-panel",
          "mock_html": "<div class=\"mock-panel\"><p>Card content goes here.</p></div>",
          "tokens_used": ["card-bg", "default", "sm", "card"]
        }
      ],
      "layout": {
        "specs": [
          { "property": "background (light)", "value": "rgb(255,255,255)", "token": "card-bg" },
          { "property": "background (dark)", "value": "rgb(46,46,46)", "token": "card-bg" },
          { "property": "border", "value": "1px solid rgb(222,226,230) / rgb(66,66,66)", "token": "default" },
          { "property": "border-radius", "value": "4px", "token": "sm" },
          { "property": "padding", "value": "16px", "token": "card-padding" },
          { "property": "box-shadow", "value": "0 1px 3px rgba(0,0,0,0.05), 0 1px 2px rgba(0,0,0,0.1)", "token": "card" }
        ]
      },
      "dos_and_donts": [
        { "type": "do", "text": "Use Mantine Card as the single wrapping container for any page-level content section." },
        { "type": "do", "text": "Maintain 16px internal padding consistently — do not override with tighter values." },
        { "type": "dont", "text": "Don't nest cards inside cards — use Accordion or Table rows for sub-grouping instead." },
        { "type": "dont", "text": "Don't use the card border-radius token (4px) for pill/badge shapes — use the pill token (1000px)." }
      ],
      "accessibility": {
        "aria_labels": null,
        "keyboard": null,
        "contrast": "Card bg passes WCAG AA for body text in both light (black on white) and dark (rgb(201,201,201) on rgb(46,46,46)).",
        "screen_reader": null
      },
      "code_example": "<Card padding=\"md\" radius=\"sm\" withBorder>\n  {/* content */}\n</Card>",
      "related_inconsistencies": ["INC-001"],
      "origin": "derived"
    },
    {
      "name": "Card Title with Icon",
      "slug": "card-title-with-icon",
      "description": "Card header variant that places a semantically relevant Tabler icon immediately before the title text. Used on /status (Build, Runtime) and /alertmanager-discovery (Active, Dropped).",
      "subtitle": "Titled card header with leading icon",
      "complexity": "simple",
      "category": "data-display",
      "pages": ["/status", "/alertmanager-discovery"],
      "props": [
        { "name": "icon", "type": "TablerIcon", "default": null, "required": true, "description": "Tabler icon component matching the card's semantic content." },
        { "name": "title", "type": "string", "default": null, "required": true, "description": "Card section heading text." }
      ],
      "variants": [
        {
          "name": "with-icon",
          "description": "Title row with leading Tabler icon (18px) followed by heading text.",
          "mock_css_class": "mock-card-title-icon",
          "mock_html": "<div class=\"mock-card-title-icon\"><span class=\"mock-icon\">🗄</span><span class=\"mock-card-title-text\">Build Information</span></div>",
          "tokens_used": ["brand-blue-light", "heading/card-title"]
        }
      ],
      "layout": {
        "specs": [
          { "property": "icon-size", "value": "18px" },
          { "property": "icon-color", "value": "Mantine primary (brand blue)" },
          { "property": "gap (icon → text)", "value": "8px", "token": "sm" },
          { "property": "font", "value": "18px / weight 600", "token": "heading/card-title" }
        ]
      },
      "dos_and_donts": [
        { "type": "do", "text": "Choose an icon that semantically relates to the card content (database → build, bell → alerts)." },
        { "type": "do", "text": "Apply this pattern consistently to all cards that currently have it — and consider extending it to cards without icons (INC-001)." },
        { "type": "dont", "text": "Don't use decorative or random icons — every icon should communicate something about the card's subject." },
        { "type": "dont", "text": "Don't mix icon-title cards and plain-title cards on the same page without visual justification." }
      ],
      "accessibility": {
        "aria_labels": "Icon should be aria-hidden='true' — the title text carries the accessible name.",
        "keyboard": null,
        "contrast": null,
        "screen_reader": "Screen readers should read the title only; hide icon with aria-hidden."
      },
      "code_example": "<Group gap=\"xs\" mb=\"xs\">\n  <IconDatabase size={18} aria-hidden />\n  <Title order={4}>Build Information</Title>\n</Group>",
      "related_inconsistencies": ["INC-001"],
      "origin": "derived"
    },
    {
      "name": "Card Title without Icon",
      "slug": "card-title-without-icon",
      "description": "Card header variant that renders only the title text with no leading icon. Used on /tsdb-status and /flags. Visually lighter than the icon variant and creates an inconsistency with icon-title cards elsewhere.",
      "subtitle": "Plain text card header",
      "complexity": "simple",
      "category": "data-display",
      "pages": ["/tsdb-status", "/flags"],
      "props": [
        { "name": "title", "type": "string", "default": null, "required": true, "description": "Card section heading text." }